Category Number,Category,Sub Category,Name,What,Special Dietary Requirements 1,Special Dietary Requirements 2,Special Dietary Requirements 3,Who,Suburb,Enter Via,Contact Person,Phone,Phone 2,Freecall,Email,Website,Alternate Website,Social Media,Monday,Tuesday,Wednesday,Thursday,Friday,Saturday,Sunday,Public Holidays,Access,Cost,Tram routes,Nearest train station,Bus routes,Car parking,Bicycle parking,Walking,Address 1,Address 2,Latitude,Longitude,Geocoded Location
10,Fresh Food Markets,Market,Queen Victoria Market,,,,,,Melbourne,,,,,,,http://www.qvm.com.au,,,Closed,6.00am - 2.00pm,Closed,6.00am - 2.00pm,6.00am - 5.00pm,6.00am - 3.00pm,9.00am - 4.00pm,Closed,,Free entry,"Routes 57, 58 and 19. Or take the free City Circle tram. Get off at the corner of La Trobe and Elizabeth Streets. ","Within walking distance of Melbourne Central Station (Elizabeth Street exit, head north) and Flagstaff Station (north along William Street).",The Melbourne Visitor Shuttle goes to the Market for $5! Get off at stop 8.,Free parking is available with entry and exit between 6am to 10am Sunday to Friday and from 6am to 8am on Saturday.,There is free bike parking in and around the Market. Major bike lanes leading to the Market run along Royal Parade and Victoria Street.,,,Corner of Victoria and Elizabeth Streets,-37.806086000000001,144.95859200000001,"(-37.806086000000001, 144.95859200000001)"
10,Fresh Food Markets,Farmer's Market,Carlton Farmers’ Market,,,,,Open to everyone,Carlton,,,,,,,http://www.mfm.com.au/markets/carlton,,,Closed,Closed,Closed,Closed,Closed,8.00am - 1.00pm,Closed,,Open every 1st and 3rd Saturday of the month,Gold coin donation for entry,"Route 1 or 8- Stop 112 Elgin Street/Lygon Street, Route 1 or 8- Stop 113 Lytton Street/Lygon St",,"Route 250 or 251 - Stop 659 Pitt Street/Rathdowne Street, Route 250 or 251- Stop 349 Kay Street/Rathdowne Street","Street Parking Available on surrounding Palmerston, Drummond, Rathdowne and Lygon Streets ",,,Carlton Primary School,Corner Palmerston and Rathdowne Streets,-37.795910999999997,144.96925999999999,"(-37.795910999999997, 144.96925999999999)"
10,Fresh Food Markets,Farmer's Market,CERES Organic Market,,,,,Open to everyone,Thornbury,,,,,,,http://www.ceres.org.au,,,9.00am to 4.00pm,9.00am to 4.00pm,9.00am to 4.00pm,9.00am to 4.00pm,9.00am to 4.00pm,9.00am to 2.00pm,9.00am to 2.00pm,,,"There is no entry cost to CERES market, but you can make a gold coin donation if you wish.",,,,,,,,Corner Roberts and Stewart Streets,-37.765690999999997,144.98230799999999,"(-37.765690999999997, 144.98230799999999)"
10,Fresh Food Markets,Farmer's Market,Gleadell Street Fresh Food Market,,,,,Open to everyone,Richmond,,,,,,,http://www.yarracity.vic.gov.au/Events/Shopping-and-dining/markets/Gleadell-Street/,,,Closed,Closed,Closed,Closed,Closed,7.00am - 1.00pm,Closed,Closed on public holidays that fall on a Saturday,,Free entry,"48 (North Balwyn – Victoria Harbour, via Collins Street) or 75 (Vermont South – City, via Flinders Street) and disembark at Stop 19 – Richmond Town Hall. ",,,,,,,Gleadell Street,-37.818376000000001,145.00152800000001,"(-37.818376000000001, 145.00152800000001)"
10,Fresh Food Markets,Farmer's Market,Slow Food Farmers’ Market,,,,,Open to everyone,Abbotsford,,,,,,,http://www.mfm.com.au/markets/slow-food-melbourne,,,Closed,Closed,Closed,Closed,Closed,8.00am - 1.00pm,Closed,,Open every 4th Saturday of the month,"$2 donation per adult, free for children",,,200 and 2007 (stop Clarke/Johnston Street (Abbotsford),"Rates: 0-30mins Free, 30min-1hr $1, 1-2hr $3, 2-3hr $4, 3-5hr $6, 5-12hr $8.",,,Abbotsford Convent,St Heliers Street,-37.802926999999997,145.00522599999999,"(-37.802926999999997, 145.00522599999999)"
11,Nutrition Education and Support,Dietitian ,CoHealth Community Health Centre - Doutta Galla,"Nutrition and dietitian services to help users to develop self-management skills around food budgeting, purchasing, preparation and cooking. ",,,,People experiencing disadvantage in the City of Melbourne,Kensington,,,(03) 8378 1600 ,,,,,,,8.30am - 5.00pm,8.30am - 5.00pm,8.30am - 5.00pm,8.30am - 5.00pm,8.30am - 5.00pm,Closed,Closed,,,,,Kensington,402 Footscray to East Melbourne - Stops at Gower Street / Macaulay Road,,,,Doutta Galla,12 Gower Street,-37.795025000000003,144.92907400000001,"(-37.795025000000003, 144.92907400000001)"
11,Nutrition Education and Support,Dietitian ,CoHealth Community Health Centre - Central City,"Nutrition and dietitian services to help users to develop self-management skills around food budgeting, purchasing, preparation and cooking. ",,,,People experiencing disadvantage in the City of Melbourne,Melbourne ,,,(03) 9677 0800 ,,1300 022 247 ,,,,,10.00am - 4.00pm,10.00am - 4.00pm,10.00am - 4.00pm,10.00am - 4.00pm,10.00am - 4.00pm,Closed,Closed,,Book an appointment between 10am to 4pm Mon to Fri or drop in Fridays between 1pm and 4pm,Free,"59, 57",Melbourne Central ,,,,,Central City ,53 Victoria Street,-37.806517999999997,144.96121400000001,"(-37.806517999999997, 144.96121400000001)"
9,Free and cheap meals,Lunch,Credo Café,Lunch,,,,Open to everyone,Melbourne,Enter via Baptist Place (basement),,(03) 9650 4023,,,david.wilson@urbanseed.org,http://www.urbanseed.org.au,,,Closed,12.00pm - 1.00pm,12.00pm - 1.00pm,Closed,Closed,Closed,Closed,Closed,Visit as often as you would like. ,Free,,,,,,,Baptist Church,174 Collins Street,-37.814960999999997,144.967725,"(-37.814960999999997, 144.967725)"
9,Free and cheap meals,Breakfast / Lunch ,St Mary’s House of Welcome,"Breakfast, lunch",,,,Open to all adults aged over 18 years,Fitzroy,,,(03) 9417 6497 ,,,admin@smhow.org.au,http://www.smhow.org.au,,,"Breakfast: 8:45am - 9:15am, Lunch: 12:00pm - 12:30pm","Breakfast: 8:45am - 9.15am, Lunch: 12:00pm - 12:30pm","Breakfast: 8:45am - 9:15am,  Lunch: 12:00pm - 12:30pm","Breakfast: 8:45am - 9:15am, Lunch: 12:00pm - 12:30pm","Breakfast: 8:45am - 9:15am, Lunch: 12:00pm - 12:30pm","Breakfast: 8:45am - 9:15am,  Lunch: 12:00pm - 12:30pm",Closed,,,"Breakfast: Free or by donation,  Lunch: $2",112,,,,,,,165-169 Brunswick Street,-37.802492000000001,144.97746000000001,"(-37.802492000000001, 144.97746000000001)"
9,Free and Cheap Meals,On Street Service,Emerald Hill Mission Food Bus,Dinner,,,,Open to everyone,"St Kilda, South Melbourne and Southbank",,,,,,enquiries@emeraldhillmission.org.au,http://www.emeraldhillmission.org.au,,,6.00pm - 8.00pm,Closed,6.00pm - 8.00pm,6.00pm - 8.00pm ,6.00pm - 8.00pm,Closed,6.00pm - 8.00pm,,,Free,"16,96",,,,,,Gatwick Hotel,34 Fitzroy Street,-37.860505,144.975571,"(-37.860505, 144.975571)"
